{
  "status": "ok", "source": "local_api",
  "service": {"state": "running", "process_running": true, "process_pid": 4200, "uptime_seconds": 86400, "api_reachable": true, "web_reachable": true, "error": null},
  "version": {"current": "2.27.2-very-long-compatible-prerelease-name", "latest": "2.28.0-release-candidate", "update_available": true, "build_info": "Example build metadata with deliberately long but bounded text for responsive layout validation", "checked_at": "2026-07-23T02:00:00Z", "stale": false, "error": null},
  "ip_resolution": {"mode": "network-interface-auto-selection-with-a-long-display-label", "resolved_ip_count": 0, "ipv4_count": 0, "ipv6_count": 0, "status": "ok", "updated_at": "2026-07-23T02:00:00Z", "stale": false, "error": null},
  "dynamic_dns": {"total": 1, "enabled": 1, "disabled": 0, "healthy": 1, "error_count": 0, "records": [{"id": "ddns-aaaaaaaaaaaa", "display_name": "A deliberately long dynamic DNS display label used only for bounded responsive layout validation", "provider": "Example multi-region DNS provider with a long display name", "enabled": true, "status": "healthy", "record_type": "AAAA", "last_update_at": "2026-07-23T02:00:00Z", "next_sync_at": "2026-07-23T02:10:00Z", "last_success_at": "2026-07-23T02:00:00Z", "error": null}], "status": "ok", "updated_at": "2026-07-23T02:00:00Z", "stale": false, "error": null},
  "web_services": {"total": 1, "enabled": 1, "disabled": 0, "healthy": 1, "error_count": 0, "services": [{"id": "web-bbbbbbbbbbbb", "display_name": "A deliberately long web service display label for overflow and tooltip validation", "enabled": true, "status": "running", "protocol": "https", "listen_port": 443, "upstream_type": "http-reverse-proxy", "tls_enabled": true, "certificate_ref": "A deliberately long sanitized certificate reference", "error": null}], "status": "ok", "updated_at": "2026-07-23T02:00:00Z", "stale": false, "error": null},
  "port_forwards": {"total": 1, "enabled": 1, "disabled": 0, "healthy": 1, "error_count": 0, "rules": [{"id": "forward-cccccccccccc", "display_name": "A deliberately long port-forward display label for mobile table validation", "enabled": true, "status": "running", "protocol": "tcp", "listen_port": 65535, "target_type": "sanitized-service-target", "error": null}], "status": "ok", "updated_at": "2026-07-23T02:00:00Z", "stale": false, "error": null},
  "certificates": {"total": 1, "valid": 0, "expiring": 1, "expired": 0, "not_yet_valid": 0, "invalid": 0, "unknown": 0, "items": [{"id": "cert-dddddddddddd", "display_name": "A deliberately long certificate display label for table truncation and responsive validation", "san_count": 24, "issuer": "Example Global Trust Services Extended Validation Certificate Authority", "source": "acme", "not_before": "2026-06-01T00:00:00Z", "not_after": "2026-08-01T00:00:00Z", "remaining_days": 9, "status": "expiring", "auto_renew": true, "last_renew_at": "2026-06-01T00:00:00Z", "next_renew_at": "2026-07-24T00:00:00Z", "error": null}], "status": "degraded", "updated_at": "2026-07-23T02:00:00Z", "stale": false, "error": null},
  "updated_at": "2026-07-23T02:00:00Z", "stale": false, "error": null
}
